{
  "schema_version": 1,
  "id": "line:christopher-ward-c60",
  "kind": "line",
  "display_name": "Christopher Ward C60",
  "aliases": [],
  "claims": [
    {
      "id": "clm-tocddyhovt",
      "predicate": "owned_by",
      "object": {
        "entity": "brand:christopher-ward"
      },
      "status": "proposed",
      "contested": false,
      "evidence": [
        {
          "id": "ev-sjaub246w7",
          "source": "source:cw-bronze-20260703",
          "quote": "C60 Pro 300 Bronze | Christopher Ward",
          "locator": "Page heading / product description; brand and model line",
          "match_mode": "exact"
        }
      ]
    }
  ]
}
