{
  "schema_version": 1,
  "id": "reference:omega-st-166-0068-1",
  "kind": "reference",
  "display_name": "OMEGA Seamaster ST 166.0068-1",
  "aliases": [],
  "claims": [
    {
      "id": "clm-2brh47va4x",
      "predicate": "in_line",
      "object": {
        "entity": "line:omega-seamaster"
      },
      "status": "proposed",
      "contested": false,
      "evidence": [
        {
          "id": "ev-zkd7bqfqju",
          "source": "source:omega-seamaster-st16600681-20220714",
          "quote": "Seamaster 1969 Omega ST 166.0068-1",
          "locator": "Vintage model heading",
          "match_mode": "exact"
        }
      ]
    },
    {
      "id": "clm-2rg7hsq437",
      "predicate": "uses_caliber",
      "object": {
        "entity": "caliber:omega-565"
      },
      "status": "proposed",
      "contested": false,
      "evidence": [
        {
          "id": "ev-usjwnczgnt",
          "source": "source:omega-seamaster-st16600681-20220714",
          "quote": "Movements Movements Caliber number 565",
          "locator": "Technical Data; Movement",
          "match_mode": "exact"
        }
      ],
      "valid_years": {
        "from": null,
        "to": null,
        "from_evidence": null,
        "to_evidence": null
      }
    }
  ]
}
