{
  "schema_version": 1,
  "id": "reference:rolex-5512",
  "kind": "reference",
  "display_name": "Rolex Submariner 5512",
  "aliases": [],
  "claims": [
    {
      "id": "clm-h4cgmwkopu",
      "predicate": "in_line",
      "object": {
        "entity": "line:rolex-submariner"
      },
      "status": "proposed",
      "contested": false,
      "evidence": [
        {
          "id": "ev-n4fcyev2bi",
          "source": "source:wikipedia-submariner-1365492288",
          "quote": "5512 1959-1978 5513 1962-1990",
          "locator": "Discontinued models table; 5512 row (neighbor cells included for excerpt length)",
          "match_mode": "exact"
        }
      ]
    },
    {
      "id": "clm-eu7wl7fuos",
      "predicate": "produced",
      "object": {
        "years": {
          "from": 1959,
          "to": 1978,
          "from_evidence": "ev-jfjgylyb4d",
          "to_evidence": "ev-jfjgylyb4d"
        }
      },
      "status": "proposed",
      "contested": false,
      "evidence": [
        {
          "id": "ev-jfjgylyb4d",
          "source": "source:wikipedia-submariner-1365492288",
          "quote": "5512 1959-1978 5513 1962-1990",
          "locator": "Discontinued models table; 5512 row, In production column (neighbor cells included)",
          "match_mode": "exact"
        }
      ]
    },
    {
      "id": "clm-weuftggbf3",
      "predicate": "uses_caliber",
      "object": {
        "entity": "caliber:rolex-1530"
      },
      "status": "proposed",
      "contested": false,
      "evidence": [
        {
          "id": "ev-piaxzzoacr",
          "source": "source:windvintage-submariner-5512-20251215",
          "quote": "Reference 5512: 1959-1980 Calibre 1530 (1959-1962) Calibre 1560 (Circa 1962-1965) Calibre 1570 (Circa 1965-1979)",
          "locator": "5512 vs. 5513; Reference 5512 movement chronology",
          "match_mode": "exact"
        }
      ],
      "valid_years": {
        "from": 1959,
        "to": 1962,
        "from_evidence": "ev-piaxzzoacr",
        "to_evidence": "ev-piaxzzoacr"
      }
    },
    {
      "id": "clm-23farc6xtk",
      "predicate": "uses_caliber",
      "object": {
        "entity": "caliber:rolex-1560"
      },
      "status": "proposed",
      "contested": false,
      "evidence": [
        {
          "id": "ev-bkv5grjhxa",
          "source": "source:windvintage-submariner-5512-20251215",
          "quote": "Reference 5512: 1959-1980 Calibre 1530 (1959-1962) Calibre 1560 (Circa 1962-1965) Calibre 1570 (Circa 1965-1979)",
          "locator": "5512 vs. 5513; Reference 5512 movement chronology",
          "match_mode": "exact"
        }
      ],
      "valid_years": {
        "from": null,
        "to": null,
        "from_evidence": null,
        "to_evidence": null
      }
    },
    {
      "id": "clm-c2mnchmohp",
      "predicate": "uses_caliber",
      "object": {
        "entity": "caliber:rolex-1570"
      },
      "status": "proposed",
      "contested": false,
      "evidence": [
        {
          "id": "ev-luwbhp6gpe",
          "source": "source:windvintage-submariner-5512-20251215",
          "quote": "Reference 5512: 1959-1980 Calibre 1530 (1959-1962) Calibre 1560 (Circa 1962-1965) Calibre 1570 (Circa 1965-1979)",
          "locator": "5512 vs. 5513; Reference 5512 movement chronology",
          "match_mode": "exact"
        }
      ],
      "valid_years": {
        "from": null,
        "to": null,
        "from_evidence": null,
        "to_evidence": null
      }
    },
    {
      "id": "clm-yiyaiaypmp",
      "predicate": "produced",
      "object": {
        "years": {
          "from": 1959,
          "to": 1980,
          "from_evidence": "ev-pj5aqrejal",
          "to_evidence": "ev-pj5aqrejal"
        }
      },
      "status": "proposed",
      "contested": false,
      "evidence": [
        {
          "id": "ev-pj5aqrejal",
          "source": "source:windvintage-submariner-5512-20251215",
          "quote": "Reference 5512: 1959-1980 Calibre 1530 (1959-1962) Calibre 1560 (Circa 1962-1965) Calibre 1570 (Circa 1965-1979)",
          "locator": "5512 vs. 5513; Reference 5512 production chronology",
          "match_mode": "exact"
        }
      ]
    },
    {
      "id": "clm-nvielxliuh",
      "predicate": "succeeds",
      "object": {
        "entity": "reference:rolex-5510"
      },
      "status": "proposed",
      "contested": false,
      "evidence": [
        {
          "id": "ev-7r7qii7s2c",
          "source": "source:windvintage-submariner-5512-20251215",
          "quote": "Both versions are 7mm crowns, which was decreased from the predecessor Submariner reference 5510 \"Big Crown\" (as well as references 6200 and 6538) that was 8mm.",
          "locator": "Twinlock vs. Triplock; article subject 5512, named predecessor 5510",
          "match_mode": "exact"
        }
      ]
    }
  ]
}
