{
  "schema_version": 1,
  "id": "reference:omega-st-166-0036",
  "kind": "reference",
  "display_name": "OMEGA Seamaster Cosmic ST 166.0036",
  "aliases": [],
  "claims": [
    {
      "id": "clm-6ldyeh26fi",
      "predicate": "in_line",
      "object": {
        "entity": "line:omega-seamaster"
      },
      "status": "proposed",
      "contested": false,
      "evidence": [
        {
          "id": "ev-mg456apgcw",
          "source": "source:omega-seamaster-st1660036-20260208",
          "quote": "Seamaster Cosmic 1967 ST 166.0036",
          "locator": "Vintage model heading",
          "match_mode": "exact"
        }
      ]
    },
    {
      "id": "clm-dx6ptamydp",
      "predicate": "uses_caliber",
      "object": {
        "entity": "caliber:omega-752"
      },
      "status": "proposed",
      "contested": false,
      "evidence": [
        {
          "id": "ev-5ugv5ywlfj",
          "source": "source:omega-seamaster-st1660036-20260208",
          "quote": "Movement type Automatic (mechanical) Caliber number 752",
          "locator": "Technical Data; Movement",
          "match_mode": "exact"
        }
      ],
      "valid_years": {
        "from": null,
        "to": null,
        "from_evidence": null,
        "to_evidence": null
      }
    }
  ]
}
