{
  "schema_version": 1,
  "id": "reference:rolex-124060",
  "kind": "reference",
  "display_name": "Rolex Submariner 124060",
  "aliases": [],
  "claims": [
    {
      "id": "clm-tueywa2idb",
      "predicate": "in_line",
      "object": {
        "entity": "line:rolex-submariner"
      },
      "status": "proposed",
      "contested": false,
      "evidence": [
        {
          "id": "ev-yickxebtou",
          "source": "source:rolex-submariner-124060-20260516",
          "quote": "SubmarinerOyster, 41 mm, OystersteelReference 124060",
          "locator": "model heading",
          "match_mode": "exact"
        }
      ]
    },
    {
      "id": "clm-gxahktqwgs",
      "predicate": "uses_caliber",
      "object": {
        "entity": "caliber:rolex-3230"
      },
      "status": "proposed",
      "contested": false,
      "evidence": [
        {
          "id": "ev-llplxdkm2z",
          "source": "source:rolex-submariner-124060-20260516",
          "quote": "Calibre 3230, Manufacture Rolex",
          "locator": "technical details; Calibre",
          "match_mode": "exact"
        }
      ],
      "valid_years": {
        "from": null,
        "to": null,
        "from_evidence": null,
        "to_evidence": null
      }
    }
  ]
}
