{
  "schema_version": 1,
  "id": "reference:seiko-spb165j1",
  "kind": "reference",
  "display_name": "Seiko Presage SPB165J1",
  "aliases": [],
  "claims": [
    {
      "id": "clm-6wgalyoqxy",
      "predicate": "in_line",
      "object": {
        "entity": "line:seiko-presage"
      },
      "status": "proposed",
      "contested": false,
      "evidence": [
        {
          "id": "ev-phyk4dynq3",
          "source": "source:seiko-presage-spb165-20260311",
          "quote": "Home Collections Presage SPB165J1",
          "locator": "Model heading and collection context",
          "match_mode": "exact"
        }
      ]
    },
    {
      "id": "clm-a3men2or3i",
      "predicate": "uses_caliber",
      "object": {
        "entity": "caliber:seiko-6r35"
      },
      "status": "proposed",
      "contested": false,
      "evidence": [
        {
          "id": "ev-bqgfsgw7dr",
          "source": "source:seiko-presage-spb165-20260311",
          "quote": "Caliber Number 6R35 Movement Type Automatic with manual winding",
          "locator": "Model movement specifications / launch page model panel",
          "match_mode": "exact"
        }
      ],
      "valid_years": {
        "from": null,
        "to": null,
        "from_evidence": null,
        "to_evidence": null
      }
    }
  ]
}
