{
  "schema_version": 1,
  "id": "caliber:eta-2824-2",
  "kind": "caliber",
  "display_name": "ETA 2824-2",
  "aliases": [],
  "claims": [
    {
      "id": "clm-ojlef2h2xt",
      "predicate": "made_by",
      "object": {
        "entity": "brand:eta"
      },
      "status": "verified",
      "contested": false,
      "evidence": [
        {
          "id": "ev-hvmn365v6y",
          "source": "source:wikipedia-eta-sa-1359500316",
          "quote": "One workhorse of the ETA mechanical line is the ETA 2824–2",
          "locator": "ETA 2824-2 section; opening sentence",
          "match_mode": "exact"
        }
      ],
      "review": {
        "by": "codex:gpt-6.1-sol:pr2 / chief",
        "at": "2026-10-08T23:16:50Z"
      }
    },
    {
      "id": "clm-i6dk5fctk4",
      "predicate": "offers_grades",
      "object": {
        "value": true
      },
      "status": "verified",
      "contested": false,
      "evidence": [
        {
          "id": "ev-tci73mkjid",
          "source": "source:wikipedia-eta-sa-1359500316",
          "quote": "The 2824 is an automatic winding, twenty-five jewel movement, available in four executions or grades: Standard, Elaborated (improved), Top and Chronometer.",
          "locator": "ETA 2824-2 section; grades paragraph",
          "match_mode": "exact"
        }
      ],
      "review": {
        "by": "codex:gpt-6.1-sol:pr2 / chief",
        "at": "2026-10-08T23:16:50Z"
      }
    },
    {
      "id": "clm-3u4xon6unn",
      "predicate": "winding",
      "object": {
        "value": "automatic"
      },
      "status": "verified",
      "contested": false,
      "evidence": [
        {
          "id": "ev-xhatzaefu7",
          "source": "source:wikipedia-eta-sa-1359500316",
          "quote": "The 2824 is an automatic winding, twenty-five jewel movement, available in four executions or grades: Standard, Elaborated (improved), Top and Chronometer.",
          "locator": "ETA 2824-2 section; grades paragraph",
          "match_mode": "exact"
        }
      ],
      "review": {
        "by": "codex:gpt-6.1-sol:pr2 / chief",
        "at": "2026-10-08T23:16:50Z"
      }
    },
    {
      "id": "clm-yeyqca4tqp",
      "predicate": "jewels",
      "object": {
        "value": 25,
        "unit": "count"
      },
      "status": "verified",
      "contested": false,
      "evidence": [
        {
          "id": "ev-l5ppnfbywb",
          "source": "source:wikipedia-eta-sa-1359500316",
          "quote": "The 2824 is an automatic winding, twenty-five jewel movement, available in four executions or grades: Standard, Elaborated (improved), Top and Chronometer.",
          "locator": "ETA 2824-2 section; grades paragraph",
          "match_mode": "exact"
        }
      ],
      "review": {
        "by": "codex:gpt-6.1-sol:pr2 / chief",
        "at": "2026-10-08T23:16:50Z"
      }
    },
    {
      "id": "clm-kx33cy7ibp",
      "predicate": "hacking",
      "object": {
        "value": true
      },
      "status": "verified",
      "contested": false,
      "evidence": [
        {
          "id": "ev-jancl72j7b",
          "source": "source:tissot-lelocle-20260608",
          "quote": "The ETA 2824-2 is the workhorse of the ETA lineup. It's an automatic winding, hacking, movement.",
          "locator": "Movement paragraph",
          "match_mode": "exact"
        }
      ],
      "review": {
        "by": "codex:gpt-6.1-sol:pr5 / chief",
        "at": "2026-10-09T01:20:45Z"
      }
    },
    {
      "id": "clm-qroi53e53o",
      "predicate": "beat_rate",
      "object": {
        "value": 28800,
        "unit": "vph"
      },
      "status": "verified",
      "contested": false,
      "evidence": [
        {
          "id": "ev-mrvwsmzhkz",
          "source": "source:eta2824-history-20260418",
          "quote": "With its Etachron regulator, the ETA 2824-2 beats at a frequency of 28,800 vibrations/hour.",
          "locator": "ETA2824-2 overview paragraph",
          "match_mode": "exact"
        }
      ],
      "review": {
        "by": "codex:gpt-6.1-sol:pr5 / chief",
        "at": "2026-10-09T01:20:45Z"
      }
    },
    {
      "id": "clm-seblfpjnsl",
      "predicate": "introduced",
      "object": {
        "value": 1982,
        "unit": "year"
      },
      "status": "verified",
      "contested": false,
      "evidence": [
        {
          "id": "ev-j5x76b3sl4",
          "source": "source:eta2824-history-20260418",
          "quote": "Since the ETA 2824-2 was introduced in 1982, its patents expired in 2002",
          "locator": "The Clone Wars section",
          "match_mode": "exact"
        }
      ],
      "review": {
        "by": "codex:gpt-6.1-sol:pr5 / chief",
        "at": "2026-10-09T01:20:45Z"
      }
    },
    {
      "id": "clm-qjgzbpc63s",
      "predicate": "made_by",
      "object": {
        "entity": "brand:eta"
      },
      "status": "verified",
      "contested": false,
      "evidence": [
        {
          "id": "ev-anoix7ql5f",
          "source": "source:wikipedia-eta-sa-1359500316",
          "quote": "One workhorse of the ETA mechanical line is the ETA 2824-2",
          "locator": "ETA 2824-2 section; existing pilot wording with normalized dash",
          "match_mode": "exact"
        },
        {
          "id": "ev-r6duwcsf5q",
          "source": "source:eta2824-pdf-20240617",
          "quote": "TECHNICAL COMMUNICATION ETA SA Manufacture Horlogère Suisse Customer Service",
          "locator": "PDF page1: ETA2824-2 cover specifications",
          "match_mode": "exact"
        }
      ],
      "review": {
        "by": "codex:gpt-6.1-sol:pr5 / chief",
        "at": "2026-10-09T01:20:45Z"
      }
    },
    {
      "id": "clm-ra2ugieb75",
      "predicate": "beat_rate",
      "object": {
        "value": 28800,
        "unit": "vph"
      },
      "status": "verified",
      "contested": false,
      "evidence": [
        {
          "id": "ev-5so7tov2dd",
          "source": "source:eta2824-history-20260418",
          "quote": "the ETA 2824-2 beats at a frequency of 28,800 vibrations/hour.",
          "locator": "ETA 2824-2 architecture and specifications",
          "match_mode": "exact"
        },
        {
          "id": "ev-rwtvzwyxbd",
          "source": "source:eta2824-pdf-20240617",
          "quote": "Fréquence Frequenz Frequency 28'800 A/h",
          "locator": "PDF page1: ETA2824-2 cover specifications",
          "match_mode": "exact"
        }
      ],
      "review": {
        "by": "codex:gpt-6.1-sol:pr5 / chief",
        "at": "2026-10-09T01:20:45Z"
      }
    },
    {
      "id": "clm-63gtvj2gvj",
      "predicate": "jewels",
      "object": {
        "value": 25,
        "unit": "count"
      },
      "status": "verified",
      "contested": false,
      "evidence": [
        {
          "id": "ev-t3eqi3ju66",
          "source": "source:eta2824-history-20260418",
          "quote": "notably the ETA 2824-2 - which has 25 jewels - and all 25-jewelled clones.",
          "locator": "Clone comparison explicitly identifies ETA 2824-2 jewel count",
          "match_mode": "exact"
        },
        {
          "id": "ev-ybkvyirros",
          "source": "source:eta2824-pdf-20240617",
          "quote": "Nombre de rubis Anzahl Rubine Number of jewels 25",
          "locator": "PDF page1: ETA2824-2 cover specifications",
          "match_mode": "exact"
        }
      ],
      "review": {
        "by": "codex:gpt-6.1-sol:pr5 / chief",
        "at": "2026-10-09T01:20:45Z"
      }
    },
    {
      "id": "clm-6hpevhgzoc",
      "predicate": "power_reserve",
      "object": {
        "value": 38,
        "unit": "hour"
      },
      "status": "proposed",
      "contested": false,
      "evidence": [
        {
          "id": "ev-mfj35zzqb6",
          "source": "source:eta2824-pdf-20240617",
          "quote": "Réserve de marche Gangreserve Running time 38 h",
          "locator": "PDF page1: ETA2824-2 cover specifications",
          "match_mode": "exact"
        }
      ]
    }
  ]
}
