{
  "schema_version": 1,
  "id": "caliber:sellita-sw300-1-top",
  "kind": "caliber",
  "display_name": "Sellita SW300-1 top",
  "aliases": [],
  "claims": [
    {
      "id": "clm-kfmq7yiq7w",
      "predicate": "grade_of",
      "object": {
        "entity": "caliber:sellita-sw300-1"
      },
      "status": "proposed",
      "contested": false,
      "evidence": [
        {
          "id": "ev-dhx5kuhul3",
          "source": "source:sellita-sw300-pdf-20260904",
          "quote": "Exécution - Ausführung - Range Elaboré Top Chronomètre",
          "locator": "PDF page4: Escapement execution table; canonical grade term",
          "match_mode": "exact"
        }
      ]
    },
    {
      "id": "clm-ts6b2xzy6f",
      "predicate": "grade_name",
      "object": {
        "value": "top"
      },
      "status": "proposed",
      "contested": false,
      "evidence": [
        {
          "id": "ev-7g7rkiekcq",
          "source": "source:sellita-sw300-pdf-20260904",
          "quote": "Exécution - Ausführung - Range Elaboré Top Chronomètre",
          "locator": "PDF page4: Escapement execution table; canonical grade term",
          "match_mode": "exact"
        }
      ]
    }
  ]
}
